{
  "sortImports": [
    "!sideEffect",
    "sourceType",
    "dotJSFirst",
    "!namespacePresence",
    "pathName",
    "sourceName"
  ],
  "sortImportElements": [
    "elementType",
    "basenameGroup",
    "elementName"
  ],
  "separateBy": [
    "unequalSideEffectUse",
    "unequalPackageState",
    "unequalNamespaceUse"
  ],
  "formatting": {
    "indent": 2,
    "bracketIndent": 0,
    "quoteStyle": "double",
    "maxColumns": 80
  },
  "require": {
    "dotJSFirst": "../compare_functions/imports/dotJSFirst.ts"
  }
}
